[
  {
    "id": "tavern",
    "name": "Village Tavern",
    "description": "A village inn with a taproom, working kitchen, simple provisions and a stable yard. The daily menu is selected from the wider catalogue.",
    "merchantNotes": {
      "alwaysStocks": [
        "Small Ale and House Hopped Beer",
        "Drinking Water",
        "Oat Porridge and Vegetable Pottage",
        "Rye Bread and Farmhouse Cheese",
        "Horse Feed for the stable yard"
      ],
      "oftenStocks": [
        "A changing selection of pies, supper plates and carved roasts",
        "Other local brews, mead and table wine",
        "Packed meals, snacks and small desserts",
        "Practical shared supplies when the innkeeper can spare them"
      ],
      "rarelyStocks": [
        "Aged cellar drinks and imported spirits",
        "Coffee, fine tea and cocoa",
        "Luxury meals, game and celebration orders"
      ]
    }
  },
  {
    "id": "general-store",
    "name": "Village General Store",
    "description": "Practical household goods, travelling supplies and containers for a small settlement.",
    "merchantNotes": {
      "alwaysStocks": [
        "Rope",
        "Sacks",
        "Candles",
        "Soap",
        "Rations",
        "Torches"
      ],
      "oftenStocks": [
        "Lanterns",
        "Tents",
        "Blankets"
      ],
      "rarelyStocks": [
        "Spyglass",
        "Silk Rope",
        "Lockbox"
      ]
    }
  },
  {
    "id": "alchemist",
    "name": "Village Alchemist",
    "description": "A modest workshop supplying common reagents and prepared remedies.",
    "merchantNotes": {
      "alwaysStocks": [
        "Empty bottles",
        "Common herbs",
        "Basic reagents"
      ],
      "oftenStocks": [
        "Prepared remedies",
        "Antitoxin",
        "Lamp oil"
      ],
      "rarelyStocks": [
        "Healing potions",
        "Rare reagents",
        "Specialist alchemical preparations"
      ]
    }
  },
  {
    "id": "blacksmith",
    "name": "Village Blacksmith",
    "description": "A working forge focused on repairs, fittings and practical ironwork.",
    "merchantNotes": {
      "alwaysStocks": [
        "Nails",
        "Horseshoes",
        "Simple iron fittings"
      ],
      "oftenStocks": [
        "Hand tools",
        "Chains",
        "Locks"
      ],
      "rarelyStocks": [
        "Fine weapons",
        "Fitted armour",
        "Specialist metalwork"
      ]
    }
  },
  {
    "id": "black-market",
    "name": "Discreet Fence",
    "description": "An irregular contact whose stock depends on recent opportunities and trusted introductions.",
    "merchantNotes": {
      "alwaysStocks": [
        "Small second-hand valuables of uncertain provenance"
      ],
      "oftenStocks": [
        "Unmarked tools",
        "Concealable containers",
        "Stolen trade goods"
      ],
      "rarelyStocks": [
        "Forged papers",
        "Restricted reagents",
        "Distinctive stolen treasures"
      ]
    }
  }
]
